3fd01d0bc4467730bd7acdcf80c8b21dff47176cd1bcc55e0545ae7a41dd9410,dd063a43e0d653b541c9df67fe3aa59cad1b6654c4e3fec675bd505e37dcbfc1,6051f8cd54356d8cdf4f681dab2d3615ffdedc9b224a4dc687fe7942b20c751f,958ce7dcdc45d1a13d5a59b6e7a44c56f3e6440c7550d9b7a8faca0ae3ae98ff,2b79c9eaee7de606f2261b5b2df5ba0ee4d64ba3b585388f906db1db46fe6773,c14b2287fbf0837db8adfc3e8d7ebd0f1dc0921c58210ecc2e160ca116e8c79c,45e16361f68feb331302faa40cf18a927092bd6ea73cba109c4c9406535fd6ff,1f9380a454444a46ed61b2ff2b75d54cd04459061d6b5b1909616128c185dff1
"1","0","說明1","0","101","1","會出現設定了蘊含高物理攻擊力，並會進行強大\n範圍攻擊的Boss。","單體物理攻擊類型"
"2","0","說明2","0","102","2","會出現設定了蘊含高魔法攻擊力，並會進行強大\n範圍攻擊的Boss。","單體魔法攻擊類型"
"3","0","說明3","0","103","3","會出現設定了以提升防禦力技能創造出傲人的高耐久力，\n並足以凌駕對手攻擊的Boss。","防禦類型"
"4","202","說明4","0","101","4","會出現設定了蘊含高物理攻擊力，並會進行強大\n範圍攻擊的複數目標Boss。","複數物理攻擊類型"
"5","202","說明5","0","102","5","會出現設定了蘊含高魔法攻擊力，並會進行強大\n範圍攻擊的複數目標Boss。","複數魔法攻擊類型"