4b178e92e3fdfa2fa1c6876b0e1db842baac86b3b9555a949fa02d375a3d8e19,c6c95365551f6dc6b3489d1a31530afea6770b1bca165b32519d7c2ff55994f8,ee44c7a97665fb615cb4d2697231261cb278e2aa686bd0f6a6acea5db3aa1728,e7fa01e7b47e2366de549080bd4722338385be821c703acad100c488b4791f3b,20fcc87d4fc0b881018a39984308d2f7e78d803cf75862d8c5bb297de23d3093,640a2298a99d7e734db3179bd930ba0d40324fe299b15a4ef15a1e867f4baa4b,34b530f413d92db7a448c2fa6ab21a3c8045dbb7b3c6852179e90e6fd6df7e55,1a91b93d09708c9e77b54177ba0b93ed8f99116fe7c1740cb2d463c2882830cd
"10001","1","1","1000100","紅色又酸酸甜甜的水果。","ㄨㄛ","ㄧㄥ","蘋果"
"10001","1","2","1000101","據說會長成智慧之樹的水果。也有人說其實那不是蘋果之類的。","ㄕ","ㄧㄣ","禁忌的果實"
"10001","1","2","1000102","吃了可以增強記憶力，提高智能的水果。","ㄨㄛ","ㄓ","智慧之果"
"10002","1","1","1000200","又強又黑還很強壯。最愛香蕉的生物。","ㄧㄥ","ㄟ","黑猩猩"
"10002","1","2","1000201","動物分類中的一種。","ㄟ","ㄧㄥ","靈長類"
"10002","1","2","1000202","形容大猩猩兇猛叫聲的擬聲語。","ㄡ","ㄨ","嗚吼嗚吼"
"10002","1","3","1000203","坐鎮於「露娜之塔」的強大仙猿。雖然不是猩猩是猴子，但也算是親戚，算你勉強通過。","ㄧㄢ","ㄓ","擲岩猴仙"
"10003","1","1","1000300","統稱特定的銅管樂器的說法。","ㄚ","ㄚ","喇叭"
"10003","1","2","1000301","銅管樂器中的一種。","ㄠ","ㄧㄠ","小號"
"10003","1","2","1000302","以管狀造型為主，多以吹奏等空氣流動方式產生樂音的樂器。","ㄧ","ㄨㄢ","管樂器"
"10004","1","1","1000400","生長在溫暖地區，黃色且味道酸甜的水果。","ㄧ","ㄥ","鳳梨"
"10004","1","1","1000401","在某些地區就是這樣叫這種水果的。","ㄨㄛ","ㄛ","菠蘿"
"10004","1","1","1000402","「鳳梨」的台語讀音。","ㄞ","ㄨㄤ","旺來"
"10005","1","1","1000500","也有人稱其為寶石女王，鮮艷的紅色寶石。","ㄕ","ㄨㄥ","紅寶石"
"10005","1","1","1000501","用在裝飾品中，既美麗又珍貴的礦物。","ㄕ","ㄠ","寶石"
"10005","1","2","1000502","帶有魔法的石頭，可以鑲嵌在武器上，也可以做施法的媒介。","ㄕ","ㄛ","魔法石"
"10005","1","3","1000503","「紫藤家」的大小姐「秋乃」戴在身上的美麗胸針。","ㄣ","ㄧㄡ","秋乃的胸針"
"10005","1","3","1000504","「秋乃」的專用裝備。紫藤家代代相傳的輝石。","ㄕ","ㄗ","紫藤紅輝石"
"10006","1","1","1000600","用穀物釀成的酒類。","ㄧㄡ","ㄧ","啤酒"
"10006","1","1","1000601","用單手拿著，裝飲料用的容器。","ㄟ","ㄧㄡ","酒杯"
"10006","1","2","1000602","「優花梨」會稱呼它「像啤酒的東西」。不能讓她喝太多。","ㄧㄡ","ㄞ","麥酒"
"10006","1","3","1000603","「優花梨」專用裝備的內容物。不管怎麼喝都會不斷地湧出來。","ㄨㄟ","ㄥ","生命之水"
"10007","1","1","1000700","用弓與箭組成的武器。","ㄧㄢ","ㄨㄥ","弓箭"
"10007","1","1","1000701","「箭」的別種說法。","ㄕ","ㄧㄢ","箭矢"
"10007","1","2","1000702","指可以飛得很遠的攻擊型武器。","ㄧ","ㄩㄢ","遠距離武器"
"10007","1","2","1000703","羅馬神話中的小愛神。","ㄜ","ㄧㄡ","邱比特"
"10007","1","2","1000704","獵殺動物的行為。","ㄧㄝ","ㄚ","打獵"
"10007","1","2","1000705","人類獵殺動物以取得資源的行為。","ㄧㄝ","ㄡ","狩獵"
"10008","1","1","1000800","在音樂上用來表示音高的記號。","ㄨ","ㄧㄣ","音符"
"10008","1","1","1000801","音樂中音符的流動。","ㄩ","ㄩㄢ","旋律"
"10008","1","2","1000802","將音階由低到高排列 3個。","ㄧ","ㄡ","ㄉㄡㄖㄨㄟㄇㄧ"
"10008","1","2","1000803","數個音符根據樂理結成的組合。","ㄧㄢ","ㄜ","和弦"
"10009","1","1","1000900","為了在畫上著色的材料。","ㄧㄠ","ㄧㄢ","顏料"
"10009","1","1","1000901","水性的顏料。","ㄞ","ㄨㄟ","水彩"
"10009","1","2","1000902","盛裝膏狀物的容器。","ㄨㄢ","ㄨㄢ","軟管"
"10009","1","2","1000903","藍色。或是憂鬱的顏色。","ㄜ","ㄢ","藍色"
"10010","1","1","1001000","以刀刃進行攻擊的武器總稱。","ㄧㄢ","ㄧㄢ","劍"
"10010","1","2","1001001","用於戰鬥的工具。","ㄧ","ㄨ","武器"
"10010","1","2","1001002","長度較短的劍。","ㄧㄢ","ㄨㄢ","短劍"
"10010","1","2","1001003","近身格鬥用的武器。","ㄧ","ㄧㄣ","近戰武器"
"10010","1","3","1001004","「貪吃佩可」的專用裝備。能帶給貪吃佩可更加強大的力量，「皇家裝備」真正的模樣。","ㄧㄢ","ㄨㄥ","公主之劍"
"10011","1","1","1001100","為了補正視力，在眼睛周邊戴在身上的道具。","ㄧㄥ","ㄧㄢ","眼鏡"
"10011","1","2","1001101","用在眼鏡或各式東西上，折射光線用的透明物體。","ㄧㄢ","ㄧㄥ","鏡片"
"10011","1","2","1001102","只知道念書並對其餘事情一竅不通的人。","ㄗ","ㄨ","書呆子"
"10011","1","2","1001103","用來變裝，拿下後原來是美女的眼鏡。","ㄩ","ㄢ","扮裝道具"
"10011","1","3","1001104","公會小屋的管理員「花凜」戴著的眼鏡。","ㄧㄥ","ㄨㄚ","花凜的眼鏡"
"10012","1","1","1001200","為了把小東西放大觀看用的道具。","ㄧㄥ","ㄤ","放大鏡"
"10012","1","1","1001201","用在放大鏡或各式物品上，讓光線曲折用的透明物體。","ㄧㄢ","ㄧㄥ","鏡片"
"10012","1","2","1001202","具有放大效果的透鏡。","ㄧㄥ","ㄨ","凸透鏡"
"10012","1","3","1001203","名偵探「霞」愛用的偵探道具之一。","ㄧㄣ","ㄣ","偵探必備的物品"
"10013","1","1","1001300","拿去烤就會噗滋地流出肉汁，是很棒的食材。","ㄡ","ㄡ","肉"
"10013","1","2","1001301","食材經過巧手烹飪後的完美傑作，讓人忍不住要品嚐美味。","ㄧ","ㄧㄠ","料理"
"10013","1","2","1001302","帶骨的肉。或是以該狀態料理的食物。光是帶骨就看起來莫名的美味。","ㄡ","ㄞ","帶骨肉"
"10013","1","3","1001303","這麼棒的帶骨肉，該不會是傳說中存在於艾爾皮斯島上的「龍」吧。","ㄡ","ㄨㄥ","龍肉"
"10014","1","1","1001400","在夜空中閃耀著金黃色的美麗星球。","ㄧㄤ","ㄩㄝ","月亮"
"10014","1","1","1001401","渾圓的閃耀著的月亮。","ㄩㄝ","ㄢ","滿月"
"10014","1","2","1001402","「月亮」的拉丁文讀音。","ㄚ","ㄨ","露娜"
"10014","1","2","1001403","農曆八月十五號。","ㄧㄝ","ㄨㄥ","中秋節"
"10014","1","2","1001404","繞著行星公轉的天體。","ㄧㄥ","ㄨㄟ","衛星"
"10015","1","1","1001500","少數會飛行的哺乳類。雖然給人會吸血的印象，但是會吸血的品種非常少。","ㄨ","ㄧㄢ","蝙蝠"
"10015","1","2","1001501","著名的吸血鬼。","ㄚ","ㄜ","德古拉"
"10015","1","3","1001502","一份簡單的工作，只要摸摸女孩的頭，或抱抱她就好。","ㄨ","ㄧ","伊莉亞的眷屬"
"10016","1","1","1001600","全身覆滿著羽毛，用翅膀飛翔的物種的統稱。","ㄟ","ㄧㄠ","鳥類"
"10016","1","2","1001601","在蘭德索爾全境裡出現的怪物總稱。","ㄨ","ㄛ","魔物"
"10016","1","2","1001602","現代鳥類的始祖。","ㄧㄠ","ㄕ","始祖鳥"
"10016","1","2","1001603","具有攻擊性的鳥類。","ㄧㄣ","ㄥ","猛禽"
"10016","1","3","1001604","被封印在書中的鳥型魔物。是初音、栞所擊退的。","ㄗ","ㄧ","席茲"
"10017","1","1","1001700","穿在腳上之物。能保護腳底免於碰到小石頭或口香糖之類的文明頂端之物。","ㄗ","ㄧㄝ","鞋子"
"10017","1","1","1001701","能夠保護到腳踝的鞋子。","ㄩㄝ","ㄨㄢ","短靴"
"10017","1","2","1001702","從大叔到女高中生的廣泛客層都愛用的流行物品。不過很可惜，煮了也不能吃。","ㄧㄝ","ㄧ","皮鞋"
"10017","1","2","1001703","包住腳的長靴。尤其編織款的時尚度無人可及。","ㄗ","ㄩㄝ","靴子"
"10017","1","2","1001704","提供防護效果的衣物。","ㄩ","ㄤ","防具"
"10018","1","1","1001800","貓科的哺乳類。因為是人類很熟悉的動物，在可愛的牠面前，人類實在無法抵抗。","ㄧ","ㄠ","貓咪"
"10018","1","1","1001801","帶有花紋的貓。","ㄠ","ㄨㄚ","花貓"
"10018","1","3","1001802","是指貓咪們。珠希會餵牠們吃飯，不過花費可不能小覷。","ㄧㄡ","ㄨ","珠希的朋友"
"10019","1","1","1001900","觀賞用的紅色小型魚類。在廟會時讓人不能不去撈的邪惡東西。","ㄩ","ㄧㄣ","金魚"
"10019","1","1","1001901","魚類一般的稱呼方式。傳說吃了會變聰明。","ㄩ","ㄧㄠ","小魚"
"10019","1","1","1001902","魚類一般的稱呼方式。據說年紀大後，比起肉會更想吃牠。","ㄩ","ㄩ","魚"
"10019","1","2","1001903","用於觀賞而非食用所飼養的魚。","ㄩ","ㄨㄢ","觀賞魚"
"10020","1","1","1002000","囓齒類的一種。","ㄨ","ㄠ","老鼠"
"10020","1","1","1002001","老鼠的叫聲，或是暱稱。","ㄓ","ㄓ","吱吱"
"10020","1","2","1002002","咬食性哺乳動物的總稱。","ㄨ","ㄧㄝ","齧齒生物"
"10021","1","1","1002100","由鳥類或爬蟲類等的雌性所產下，以殼包覆著的球狀物體。","ㄢ","ㄢ","蛋"
"10021","1","2","1002101","雌性生物的生殖細胞。","ㄨㄢ","ㄨㄢ","卵"
"10021","1","2","1002102","鳥類用樹枝築成的家，會在這裡産卵。","ㄠ","ㄧㄠ","鳥巢"
"10021","1","2","1002103","燕子所築的巢，中醫認為其有高度營養價值。","ㄨㄛ","ㄧㄢ","燕窩"
"10022","1","1","1002200","載著人或物在水上前進的交通工具。","ㄨㄢ","ㄨㄢ","船"
"10022","1","1","1002201","海軍使用的軍用船隻。","ㄧㄢ","ㄩㄣ","軍艦"
"10022","1","2","1002202","張帆後以風力前進的船。","ㄨㄢ","ㄢ","帆船"
"10022","1","2","1002203","以大型船隻航海。","ㄞ","ㄤ","航海"
"10022","1","2","1002204","十五世紀歐洲人開始開發遠程海上航線的時代。","ㄞ","ㄚ","大航海時代"
"10022","1","2","1002205","互通有無的大規模商業行為。","ㄧ","ㄠ","貿易"
"10023","1","1","1002300","牛所流出的乳汁。除了可以直接飲用，還能加工成起司或奶油，是很棒的東西。","ㄞ","ㄧㄡ","牛奶"
"10023","1","2","1002301","「牛奶」的別種說法。要說出口有點丟臉。","ㄟ","ㄟ","ㄋㄟㄋㄟ"
"10023","1","2","1002302","某些地區是這麼稱呼優酪乳的。","ㄞ","ㄨㄢ","酸奶"
"10023","1","3","1002303","伊麗莎白牧場裡的牛的名字，是真陽的夥伴。","ㄞ","ㄧ","伊麗莎白"
"10024","1","1","1002400","將可可豆加工後的點心。在2月14日會被人大量消耗。","ㄧ","ㄧㄠ","巧克力"
"10024","1","2","1002401","賭神愛吃的甜食。","ㄧ","ㄨ","朱古力"
"10024","1","2","1002402","味道是甜的，疲倦時會想吃。","ㄕ","ㄧㄢ","甜食"
"10024","1","3","1002403","一旦試過就再也無法放手。","ㄧ","ㄨㄛ","哆啦喜歡的東西"
"10025","1","1","1002500","堅硬樹木的果實。不適合人類食用，但會刺激小孩子的收集慾望，充滿魅力的樹木的果實。","ㄨㄛ","ㄧㄤ","橡果"
"10025","1","2","1002501","會長成樹木的果實。","ㄕ","ㄨㄛ","果實"
"10025","1","2","1002502","被硬殼包覆著食用的果實。可放入點心或是當成下酒菜，在各處受到重用。","ㄨㄛ","ㄧㄢ","堅果"
"10025","1","3","1002503","雖然不及紅豆麵包，但鈴好像也喜歡的樣子。對戰時丟向敵人能讓其暈眩。","ㄧㄣ","ㄧㄥ","鈴的點心"
"10026","1","1","1002600","小小的又酸酸甜甜的水果。一顆顆的會被以為是種子，其實是果實。","ㄟ","ㄠ","草莓"
"10026","1","2","1002601","在野外自由生長的莓果。","ㄟ","ㄧㄝ","野莓"
"10026","1","2","1002602","一種小的、果肉狀的且可經常食用的水果。","ㄨㄛ","ㄟ","莓果"
"10027","1","1","1002700","大型貓科猛獸，肉食動物。","ㄨ","ㄠ","老虎"
"10027","1","2","1002701","高攻擊性動物的俗稱，通常是肉食動物。","ㄡ","ㄥ","猛獸"
"10027","1","3","1002702","虎虎！","ㄧㄥ","ㄛ","茉莉的憧憬"
"10027","1","3","1002703","茉莉仰慕的正義英雄。不能吐嘈那名字。","ㄨ","ㄨ","無敵英雄虎虎"
"10028","1","1","1002800","有著長長耳朵和短短尾巴的可愛哺乳類。作為寵物也很受歡迎。","ㄗ","ㄨ","兔子"
"10028","1","1","1002801","將布縫合後裝入棉花，做成像人或動物的形狀的東西。","ㄡ","ㄨㄢ","玩偶"
"10028","1","2","1002802","仿造人或生物製作的東西。有各種材質，可當玩具或作觀賞用、祭祀用等有各種用途。","ㄨㄚ","ㄨㄚ","娃娃"
"10028","1","3","1002803","真步的一隻玩偶。名稱的意象來自亞瑟王和圓桌騎士。","ㄜ","ㄧㄚ","亞瑟"
"10029","1","1","1002900","爆發後會產生熱與衝擊，並破壞、殺傷對方的一種兵器。超危險。","ㄢ","ㄚ","炸彈"
"10029","1","2","1002901","可能會危及生物或環境的物質。操作時可能需要有證照。","ㄧㄣ","ㄨㄟ","危險物品"
"10029","1","2","1002902","指可以飛得很遠的攻擊型武器，會爆炸的東西還是丟的遠遠的比較好吧？","ㄧ","ㄩㄢ","遠距離武器"
"10029","1","3","1002903","還是好好地被罵一次比較好。","ㄩ","ㄧ","禊的惡作劇道具"
"10030","1","1","1003000","瓜科的大型果實。綠色條紋的外皮，紅色果肉與黑色種子令人印象深刻。","ㄨㄚ","ㄧ","西瓜"
"10030","1","2","1003001","用來表示夏天感覺的東西。除了西瓜，其他還有大海或煙火等。","ㄧㄥ","ㄧㄚ","夏天風情"
"10030","1","2","1003002","某些食物吃了會有消暑的感覺。","ㄨㄛ","ㄧㄥ","清涼退火"
"10031","1","1","1003100","馬科的大型哺乳類。由於力量強大，還能快速跑步，大家很常將其作為家畜或賽馬。","ㄚ","ㄚ","馬"
"10031","1","1","1003101","馬科的哺乳類。和馬比起來雖然小，但力量強大，作為勞動力很受人重視。","ㄗ","ㄩ","驢子"
"10031","1","2","1003102","用馬的種類將品種改良成競賽用的類型。","ㄚ","ㄨㄣ","純種馬"
"10031","1","3","1003103","戰隊競賽時登場的馬型魔物。","ㄧㄢ","ㄥ","夢魘"
"10032","1","1","1003200","為了坐下用的家具。也有顯示職位、地位的意義。","ㄗ","ㄧ","椅子"
"10032","1","2","1003201","放在室內，平時使用的道具總稱。","ㄩ","ㄧㄚ","家具"
"10032","1","2","1003202","小學生使用的課桌椅。","ㄧ","ㄧㄠ","小學椅"
"10032","1","3","1003203","放在公會小屋的家具或裝飾品。從豪華的設計到獨特的物品，其變化非常豐富。","ㄩ","ㄨㄥ","公會小屋道具"
"10033","1","1","1003300","在陸地之外的凹陷處會不斷蓄滿水的地方。","ㄞ","ㄞ","海"
"10033","1","1","1003301","陸地和大海相連的地方。","ㄢ","ㄧㄢ","淺灘"
"10033","1","2","1003302","受到月球引力影響，海水往陸地推移或遠離的現象。","ㄧ","ㄠ","潮汐"
"10033","1","2","1003303","海浪受岸邊地形影響被打散時所出現的四濺水花。","ㄨㄚ","ㄤ","浪花"
"10033","1","3","1003304","雖然是可以從蘭德索爾徒步到達的受歡迎海灘，但是常出現魔物，意外的很危險。","ㄢ","ㄚ","瑪爾傑海岸"
"10034","1","1","1003400","包覆在貝類外側的殼。掉在沙灘上會讓人不自覺想收集。","ㄜ","ㄟ","貝殼"
"10034","1","2","1003401","有著堅硬外骨骼的節肢動物。蝦、蟹，還有水蚤都算在內。","ㄟ","ㄧㄚ","甲殼類"
"10034","1","3","1003402","蘭德索爾的所到之處出現的魔物。外觀像鎧甲一樣堅硬，是難對付的敵人。","ㄕ","ㄧ","寄居蟹騎士"
"10035","1","1","1003500","一般是指木管樂器。分為直笛與橫笛。","ㄧ","ㄧ","笛"
"10035","1","1","1003501","木管樂器之一。不能用來玩擊劍遊戲。","ㄧ","ㄓ","直笛"
"10035","1","2","1003502","樂器分類中的一種。吹入氣息，震動管內的空氣來發出聲音。","ㄧ","ㄨㄢ","管樂器"
"10035","1","2","1003503","以直立方式吹奏的笛子。直笛或單簧管等。","ㄧ","ㄨ","豎笛"
"10036","1","1","1003600","在一疊紙上印刷文字或圖畫後裝訂成冊的東西。","ㄣ","ㄨ","書本"
"10036","1","1","1003601","寫下文字或圖畫用的文具。","ㄧ","ㄧ","筆記"
"10036","1","2","1003602","創作的故事。有戀愛、歷史、推理等，種類繁多。","ㄨㄛ","ㄧㄠ","小說"
"10036","1","3","1003603","是書嗎？還是魔杖？","ㄨ","ㄞ","凱留的魔導書"
"10037","1","1","1003700","魚類一般的稱呼方式。傳說吃了會變聰明。","ㄩ","ㄩ","魚"
"10037","1","1","1003701","魚類一般的稱呼方式。據說年紀大後，比起肉會更想吃牠。","ㄩ","ㄧㄠ","小魚"
"10037","1","2","1003702","魚的一種。又大又美味的高級魚。說到壽司就是這個。","ㄩ","ㄨㄟ","鮪魚"
"10037","1","2","1003703","生活在海洋中的生命體。","ㄨ","ㄞ","海洋生物"
"10038","1","1","1003800","是樹木。","ㄨ","ㄨ","樹"
"10038","1","2","1003801","用來當聖誕樹的針葉樹。大株的還會長到40公尺。","ㄨ","ㄢ","杉木"
"10038","1","2","1003802","雖然不清楚是何時開始及為什麼，但是聖誕老公公送禮的日子。","ㄧㄝ","ㄥ","聖誕節"
"10038","1","2","1003803","耶誕節時的標誌裝飾物，將燈飾、彩帶等飾品掛在樹上而成。","ㄨ","ㄧㄝ","耶誕樹"
"10038","1","2","1003804","聖誕節前一天的夜晚，也指聖誕節天亮前的深夜。","ㄧㄝ","ㄧㄥ","平安夜"
"10038","1","3","1003805","和千歌一起，在聖夜於咲戀育幼院發生的奇蹟故事。","ㄜ","ㄨㄤ","忘却的頌歌"
"10039","1","1","1003900","有棍子的糖果。","ㄤ","ㄤ","棒棒糖"
"10039","1","2","1003901","甜甜的很好吃，含在口中的感覺最棒了！","ㄕ","ㄧㄢ","甜食"
"10039","1","3","1003902","光是拿著，那畫面就像一幅畫。","ㄧㄣ","ㄜ","克蘿依的點心"
"10040","1","1","1004000","上面是柔軟的，用波浪管製成的玩具。被打到會發出滑稽的聲音。","ㄨㄟ","ㄨㄢ","玩具槌"
"10040","1","2","1004001","上面是由金屬製成的鈍器。被打到會很痛。","ㄨㄟ","ㄧㄝ","鐵鎚"
"10040","1","2","1004002","小槌子。搖晃它可能會出現各種東西，也可能不會出現。","ㄨㄟ","ㄧㄠ","小槌"
"10040","1","3","1004003","祈梨的武器。動作很可愛，但進行的攻擊很兇狠。","ㄧ","ㄧ","祈梨的武器"
"10041","1","1","1004100","在夜空發光的天體。","ㄧㄥ","ㄧㄥ","星星"
"10041","1","2","1004101","星形的海洋生物。不適合食用。","ㄧㄥ","ㄞ","海星"
"10041","1","2","1004102","發光模樣的一種表現。","ㄧㄥ","ㄧㄤ","亮晶晶"
"10041","1","2","1004103","初音的必殺技","ㄧㄥ","ㄧㄡ","流星"
"10041","1","3","1004104","不從空中看的話不會知道。","ㄨㄤ","ㄢ","蘭德索爾的形狀"
"10042","1","1","1004200","戴在頭上的飾品。","ㄗ","ㄠ","帽子"
"10042","1","1","1004201","謹守禮儀的男士，也可以指社經地位高的人士。","ㄕ","ㄣ","紳士"
"10042","1","2","1004202","「帽子」的種類之一。","ㄠ","ㄧ","禮帽"
"10043","1","1","1004300","裝飲料等的容器。","ㄗ","ㄟ","杯子"
"10043","1","1","1004301","以可可樹的果實製成的飲品。","ㄜ","ㄜ","可可"
"10043","1","2","1004302","「杯子」的種類之一。","ㄟ","ㄚ","馬克杯"
"10043","1","2","1004303","混合巧克力的咖啡。","ㄚ","ㄛ","摩卡"
"10044","1","1","1004400","會汪汪叫的動物。","ㄡ","ㄡ","狗"
"10044","1","1","1004401","「狗」的別種說法。","ㄩㄢ","ㄩㄢ","犬"
"10044","1","2","1004402","「狗」的同類。野生之力。","ㄤ","ㄤ","狼"
"10044","1","2","1004403","哈士奇的暱稱。","ㄩㄝ","ㄩㄝ","月月"
"10044","1","2","1004404","非常像狼的大型犬種，可以當作寵物，如果你可以接受牠許多讓人哭笑不得的行為。","ㄧ","ㄚ","哈士奇"
"10045","1","1","1004500","輕飄飄的布。","ㄗ","ㄧ","旗子"
"10045","1","2","1004501","軍隊在戰鬥時使用的旗子，用以分辨敵我，也可以當作下達指令的工具。","ㄧ","ㄢ","戰旗"
"10045","1","2","1004502","用來傳遞訊息的旗子，通常是透過暗號或旗語來運作。","ㄧ","ㄧㄣ","信號旗"
"10046","1","1","1004600","很棒的點心。甜甜的很好吃。","ㄠ","ㄢ","蛋糕"
"10046","1","2","1004601","很棒的食物。","ㄧㄣ","ㄧㄢ","點心"
"10046","1","2","1004602","準備好要唱生日快樂歌了嗎？","ㄜ","ㄥ","生日快樂"
"10046","1","3","1004603","羈絆的深遠不只是共同渡過的時間。卡路里也是羈絆的證明……","ㄨ","ㄧ","羈絆點數"
"10046","1","3","1004604","大家的最愛，就不說是什麼了，直接加上30羈絆值。","ㄠ","ㄨㄥ","綜合莓果蛋糕"
"10047","1","1","1004700","將聲音轉換成信號的裝置。","ㄥ","ㄞ","麥克風"
"10047","1","2","1004701","麥克風是唱歌的必需品！","ㄜ","ㄤ","唱歌"
"10047","1","2","1004702","在舞台上現場演奏。","ㄨㄟ","ㄧㄢ","演唱會"
"10047","1","2","1004703","要是沒有這個就無法開始。","ㄧㄣ","ㄡ","偶像的必備物品"
"10047","1","3","1004704","望的專用裝備。有慈樂之音的標誌！","ㄥ","ㄢ","閃耀麥克風"
"10048","1","1","1004800","能襯出嘴唇的化妝品。","ㄨㄥ","ㄡ","口紅"
"10048","1","1","1004801","抹在嘴唇上，用來保護嘴唇的保養品。","ㄠ","ㄨㄣ","唇膏"
"10048","1","2","1004802","為了美觀而塗抹在臉上的物品。","ㄧㄣ","ㄨㄚ","化妝品"
"10049","1","1","1004900","將穀物蒸煮後的東西。也是吉祥物。","ㄠ","ㄧㄢ","年糕"
"10049","1","1","1004901","「年糕」的別種說法。","ㄨ","ㄚ","麻糬"
"10049","1","2","1004902","新年時可以供奉神佛，一大一小相疊的糯米糕。","ㄧㄥ","ㄧㄥ","鏡餅"
"10049","1","2","1004903","年糕的主要營養素。小心不要吃太多。","ㄨ","ㄢ","碳水化合物"
"10049","1","2","1004904","以糯米製成的點心。","ㄠ","ㄨㄛ","糯米糕"
"10050","1","1","1005000","嬌小又長著翅膀的種族。","ㄧㄥ","ㄧㄠ","妖精"
"10050","1","3","1005001","住在公會小屋的惡作劇妖精。","ㄧㄚ","ㄧㄝ","涅比亞"
"10051","1","1","1005100","主要是避雨用的傘。","ㄢ","ㄩ","雨傘"
"10051","1","2","1005101","主要是遮陽用的傘。","ㄢ","ㄜ","遮陽傘"
"10051","1","2","1005102","主要是遮陽用的傘。","ㄢ","ㄧㄤ","陽傘"
"10051","1","3","1005103","盛夏時海灘公主的必需品！","ㄖ","ㄢ","貪吃佩可夏日"
"10052","1","1","1005200","為了產生亂數用的道具。","ㄗ","ㄞ","骰子"
"10052","1","2","1005201","賭博。骰子上的數字讓人一喜一憂。","ㄛ","ㄨ","賭博"
"10052","1","2","1005202","一般的骰子形狀。","ㄧ","ㄧㄡ","六面體"
"10052","1","2","1005203","使用骰子的桌遊。","ㄨㄥ","ㄚ","大富翁"
"10052","1","2","1005204","一種以骰子進行的賭博遊戲，許多香腸攤老闆都對這個遊戲有自己的見解。","ㄚ","ㄧ","洗八啦"
"10053","1","1","1005300","將無法言喻的心意化為文字。","ㄧㄣ","ㄧㄣ","信"
"10053","1","2","1005301","透過郵遞系統移動的書信或包裹。","ㄧㄢ","ㄧㄡ","郵件"
"10053","1","2","1005302","用來傳達愛意的信。","ㄨ","ㄧㄥ","情書"
"10053","1","2","1005303","用來傳遞訊息的文件。","ㄧㄣ","ㄨ","書信"
"10053","1","2","1005304","古代利用鴿子傳遞訊息的方法。","ㄨ","ㄟ","飛鴿傳書"
"10054","1","1","1005400","是一串的。旁邊的好像很酸。","ㄠ","ㄨ","葡萄"
"10054","1","1","1005401","紫色的葡萄，說到葡萄，還是紫色的最常見。","ㄠ","ㄗ","紫葡萄"
"10054","1","2","1005402","「葡萄」的種類之一。","ㄥ","ㄩ","巨峰"
"10055","1","1","1005500","有著鬆軟的毛。","ㄧㄤ","ㄧㄢ","綿羊"
"10055","1","1","1005501","對小孩子說羊的時候，有時候會這麼說。","ㄧㄝ","ㄧㄤ","羊咩咩"
"10055","1","2","1005502","白色的羊。","ㄧㄤ","ㄞ","白羊"
"10055","1","2","1005503","真可愛呀～♪","ㄧㄤ","ㄚ","瑪莉有隻小綿羊"
"10056","1","1","1005600","用豆子製成的東國料理。","ㄨ","ㄡ","豆腐"
"10056","1","2","1005601","「豆腐」的種類之一。野性的口感。","ㄨ","ㄨ","木綿豆腐"
"10056","1","2","1005602","代表性的豆腐料理。","ㄨ","ㄧㄤ","涼拌豆腐"
"10056","1","2","1005603","杏仁做成的形狀像豆腐的甜品。","ㄨ","ㄧㄥ","杏仁豆腐"
"10057","1","1","1005700","不會飛的鳥。會嗄嗄的叫。","ㄗ","ㄧㄚ","鴨子"
"10057","1","2","1005701","也有會飛的鳥。也有不會飛的鳥。","ㄟ","ㄧㄠ","鳥類"
"10057","1","2","1005702","依水而生的鳥類。","ㄧㄠ","ㄨㄟ","水鳥"
"10058","1","1","1005800","在空中飛的昆蟲。","ㄧㄥ","ㄧㄥ","蜻蜓"
"10058","1","2","1005801","「蜻蜓」的種類之一。","ㄧㄥ","ㄧㄢ","晏蜓"
"10058","1","2","1005802","六支腳的動物。","ㄨㄥ","ㄨㄣ","昆蟲"
"10058","1","2","1005803","「蜻蜓」的英文稱呼，直譯後的意思，很厲害吧。","ㄨㄥ","ㄟ","飛龍"
"10059","1","1","1005900","高等植物的營養器官。","ㄗ","ㄧㄝ","葉子"
"10059","1","1","1005901","樹木的葉子。","ㄧㄝ","ㄨ","樹葉"
"10059","1","2","1005902","綠色的葉子。","ㄧㄝ","ㄩ","綠葉"
"10059","1","3","1005903","碧可以毫無顧慮聊天的少數的朋友。是朋友。","ㄧㄡ","ㄧ","碧的朋友"
"10060","1","1","1006000","戴在手指上的飾品。","ㄓ","ㄧㄝ","戒指"
"10060","1","1","1006001","鑲有鑽石的戒指。","ㄧㄝ","ㄨㄢ","鑽戒"
"10060","1","2","1006002","圓圓的環。","ㄨㄢ","ㄓ","指環"
