1a91b93d09708c9e77b54177ba0b93ed8f99116fe7c1740cb2d463c2882830cd,640a2298a99d7e734db3179bd930ba0d40324fe299b15a4ef15a1e867f4baa4b,ee44c7a97665fb615cb4d2697231261cb278e2aa686bd0f6a6acea5db3aa1728,4b178e92e3fdfa2fa1c6876b0e1db842baac86b3b9555a949fa02d375a3d8e19,20fcc87d4fc0b881018a39984308d2f7e78d803cf75862d8c5bb297de23d3093,34b530f413d92db7a448c2fa6ab21a3c8045dbb7b3c6852179e90e6fd6df7e55,c6c95365551f6dc6b3489d1a31530afea6770b1bca165b32519d7c2ff55994f8,e7fa01e7b47e2366de549080bd4722338385be821c703acad100c488b4791f3b
"蘋果","ㄨㄛ","1","10001","紅色又酸酸甜甜的水果。","ㄧㄥ","1","1000100"
"禁忌的果實","ㄕ","2","10001","據說會長成智慧之樹的水果。也有人說其實那不是蘋果之類的。","ㄧㄣ","1","1000101"
"智慧之果","ㄨㄛ","2","10001","吃了可以增強記憶力，提高智能的水果。","ㄓ","1","1000102"
"黑猩猩","ㄧㄥ","1","10002","又強又黑還很強壯。最愛香蕉的生物。","ㄟ","1","1000200"
"靈長類","ㄟ","2","10002","動物分類中的一種。","ㄧㄥ","1","1000201"
"嗚吼嗚吼","ㄡ","2","10002","形容大猩猩兇猛叫聲的擬聲語。","ㄨ","1","1000202"
"擲岩猴仙","ㄧㄢ","3","10002","坐鎮於「露娜之塔」的強大仙猿。雖然不是猩猩是猴子，但也算是親戚，算你勉強通過。","ㄓ","1","1000203"
"喇叭","ㄚ","1","10003","統稱特定的銅管樂器的說法。","ㄚ","1","1000300"
"小號","ㄠ","2","10003","銅管樂器中的一種。","ㄧㄠ","1","1000301"
"管樂器","ㄧ","2","10003","以管狀造型為主，多以吹奏等空氣流動方式產生樂音的樂器。","ㄨㄢ","1","1000302"
"鳳梨","ㄧ","1","10004","生長在溫暖地區，黃色且味道酸甜的水果。","ㄥ","1","1000400"
"菠蘿","ㄨㄛ","1","10004","在某些地區就是這樣叫這種水果的。","ㄛ","1","1000401"
"旺來","ㄞ","1","10004","「鳳梨」的台語讀音。","ㄨㄤ","1","1000402"
"紅寶石","ㄕ","1","10005","也有人稱其為寶石女王，鮮艷的紅色寶石。","ㄨㄥ","1","1000500"
"寶石","ㄕ","1","10005","用在裝飾品中，既美麗又珍貴的礦物。","ㄠ","1","1000501"
"魔法石","ㄕ","2","10005","帶有魔法的石頭，可以鑲嵌在武器上，也可以做施法的媒介。","ㄛ","1","1000502"
"秋乃的胸針","ㄣ","3","10005","「紫藤家」的大小姐「秋乃」戴在身上的美麗胸針。","ㄧㄡ","1","1000503"
"紫藤紅輝石","ㄕ","3","10005","「秋乃」的專用裝備。紫藤家代代相傳的輝石。","ㄗ","1","1000504"
"啤酒","ㄧㄡ","1","10006","用穀物釀成的酒類。","ㄧ","1","1000600"
"酒杯","ㄟ","1","10006","用單手拿著，裝飲料用的容器。","ㄧㄡ","1","1000601"
"麥酒","ㄧㄡ","2","10006","「優花梨」會稱呼它「像啤酒的東西」。不能讓她喝太多。","ㄞ","1","1000602"
"生命之水","ㄨㄟ","3","10006","「優花梨」專用裝備的內容物。不管怎麼喝都會不斷地湧出來。","ㄥ","1","1000603"
"弓箭","ㄧㄢ","1","10007","用弓與箭組成的武器。","ㄨㄥ","1","1000700"
"箭矢","ㄕ","1","10007","「箭」的別種說法。","ㄧㄢ","1","1000701"
"遠距離武器","ㄧ","2","10007","指可以飛得很遠的攻擊型武器。","ㄩㄢ","1","1000702"
"邱比特","ㄜ","2","10007","羅馬神話中的小愛神。","ㄧㄡ","1","1000703"
"打獵","ㄧㄝ","2","10007","獵殺動物的行為。","ㄚ","1","1000704"
"狩獵","ㄧㄝ","2","10007","人類獵殺動物以取得資源的行為。","ㄡ","1","1000705"
"音符","ㄨ","1","10008","在音樂上用來表示音高的記號。","ㄧㄣ","1","1000800"
"旋律","ㄩ","1","10008","音樂中音符的流動。","ㄩㄢ","1","1000801"
"ㄉㄡㄖㄨㄟㄇㄧ","ㄧ","2","10008","將音階由低到高排列 3個。","ㄡ","1","1000802"
"和弦","ㄧㄢ","2","10008","數個音符根據樂理結成的組合。","ㄜ","1","1000803"
"顏料","ㄧㄠ","1","10009","為了在畫上著色的材料。","ㄧㄢ","1","1000900"
"水彩","ㄞ","1","10009","水性的顏料。","ㄨㄟ","1","1000901"
"軟管","ㄨㄢ","2","10009","盛裝膏狀物的容器。","ㄨㄢ","1","1000902"
"藍色","ㄜ","2","10009","藍色。或是憂鬱的顏色。","ㄢ","1","1000903"
"劍","ㄧㄢ","1","10010","以刀刃進行攻擊的武器總稱。","ㄧㄢ","1","1001000"
"武器","ㄧ","2","10010","用於戰鬥的工具。","ㄨ","1","1001001"
"短劍","ㄧㄢ","2","10010","長度較短的劍。","ㄨㄢ","1","1001002"
"近戰武器","ㄧ","2","10010","近身格鬥用的武器。","ㄧㄣ","1","1001003"
"公主之劍","ㄧㄢ","3","10010","「貪吃佩可」的專用裝備。能帶給貪吃佩可更加強大的力量，「皇家裝備」真正的模樣。","ㄨㄥ","1","1001004"
"眼鏡","ㄧㄥ","1","10011","為了補正視力，在眼睛周邊戴在身上的道具。","ㄧㄢ","1","1001100"
"鏡片","ㄧㄢ","2","10011","用在眼鏡或各式東西上，折射光線用的透明物體。","ㄧㄥ","1","1001101"
"書呆子","ㄗ","2","10011","只知道念書並對其餘事情一竅不通的人。","ㄨ","1","1001102"
"扮裝道具","ㄩ","2","10011","用來變裝，拿下後原來是美女的眼鏡。","ㄢ","1","1001103"
"花凜的眼鏡","ㄧㄥ","3","10011","公會小屋的管理員「花凜」戴著的眼鏡。","ㄨㄚ","1","1001104"
"放大鏡","ㄧㄥ","1","10012","為了把小東西放大觀看用的道具。","ㄤ","1","1001200"
"鏡片","ㄧㄢ","1","10012","用在放大鏡或各式物品上，讓光線曲折用的透明物體。","ㄧㄥ","1","1001201"
"凸透鏡","ㄧㄥ","2","10012","具有放大效果的透鏡。","ㄨ","1","1001202"
"偵探必備的物品","ㄧㄣ","3","10012","名偵探「霞」愛用的偵探道具之一。","ㄣ","1","1001203"
"肉","ㄡ","1","10013","拿去烤就會噗滋地流出肉汁，是很棒的食材。","ㄡ","1","1001300"
"料理","ㄧ","2","10013","食材經過巧手烹飪後的完美傑作，讓人忍不住要品嚐美味。","ㄧㄠ","1","1001301"
"帶骨肉","ㄡ","2","10013","帶骨的肉。或是以該狀態料理的食物。光是帶骨就看起來莫名的美味。","ㄞ","1","1001302"
"龍肉","ㄡ","3","10013","這麼棒的帶骨肉，該不會是傳說中存在於艾爾皮斯島上的「龍」吧。","ㄨㄥ","1","1001303"
"月亮","ㄧㄤ","1","10014","在夜空中閃耀著金黃色的美麗星球。","ㄩㄝ","1","1001400"
"滿月","ㄩㄝ","1","10014","渾圓的閃耀著的月亮。","ㄢ","1","1001401"
"露娜","ㄚ","2","10014","「月亮」的拉丁文讀音。","ㄨ","1","1001402"
"中秋節","ㄧㄝ","2","10014","農曆八月十五號。","ㄨㄥ","1","1001403"
"衛星","ㄧㄥ","2","10014","繞著行星公轉的天體。","ㄨㄟ","1","1001404"
"蝙蝠","ㄨ","1","10015","少數會飛行的哺乳類。雖然給人會吸血的印象，但是會吸血的品種非常少。","ㄧㄢ","1","1001500"
"德古拉","ㄚ","2","10015","著名的吸血鬼。","ㄜ","1","1001501"
"伊莉亞的眷屬","ㄨ","3","10015","一份簡單的工作，只要摸摸女孩的頭，或抱抱她就好。","ㄧ","1","1001502"
"鳥類","ㄟ","1","10016","全身覆滿著羽毛，用翅膀飛翔的物種的統稱。","ㄧㄠ","1","1001600"
"魔物","ㄨ","2","10016","在蘭德索爾全境裡出現的怪物總稱。","ㄛ","1","1001601"
"始祖鳥","ㄧㄠ","2","10016","現代鳥類的始祖。","ㄕ","1","1001602"
"猛禽","ㄧㄣ","2","10016","具有攻擊性的鳥類。","ㄥ","1","1001603"
"席茲","ㄗ","3","10016","被封印在書中的鳥型魔物。是初音、栞所擊退的。","ㄧ","1","1001604"
"鞋子","ㄗ","1","10017","穿在腳上之物。能保護腳底免於碰到小石頭或口香糖之類的文明頂端之物。","ㄧㄝ","1","1001700"
"短靴","ㄩㄝ","1","10017","能夠保護到腳踝的鞋子。","ㄨㄢ","1","1001701"
"皮鞋","ㄧㄝ","2","10017","從大叔到女高中生的廣泛客層都愛用的流行物品。不過很可惜，煮了也不能吃。","ㄧ","1","1001702"
"靴子","ㄗ","2","10017","包住腳的長靴。尤其編織款的時尚度無人可及。","ㄩㄝ","1","1001703"
"防具","ㄩ","2","10017","提供防護效果的衣物。","ㄤ","1","1001704"
"貓咪","ㄧ","1","10018","貓科的哺乳類。因為是人類很熟悉的動物，在可愛的牠面前，人類實在無法抵抗。","ㄠ","1","1001800"
"花貓","ㄠ","1","10018","帶有花紋的貓。","ㄨㄚ","1","1001801"
"珠希的朋友","ㄧㄡ","3","10018","是指貓咪們。珠希會餵牠們吃飯，不過花費可不能小覷。","ㄨ","1","1001802"
"金魚","ㄩ","1","10019","觀賞用的紅色小型魚類。在廟會時讓人不能不去撈的邪惡東西。","ㄧㄣ","1","1001900"
"小魚","ㄩ","1","10019","魚類一般的稱呼方式。傳說吃了會變聰明。","ㄧㄠ","1","1001901"
"魚","ㄩ","1","10019","魚類一般的稱呼方式。據說年紀大後，比起肉會更想吃牠。","ㄩ","1","1001902"
"觀賞魚","ㄩ","2","10019","用於觀賞而非食用所飼養的魚。","ㄨㄢ","1","1001903"
"老鼠","ㄨ","1","10020","囓齒類的一種。","ㄠ","1","1002000"
"吱吱","ㄓ","1","10020","老鼠的叫聲，或是暱稱。","ㄓ","1","1002001"
"齧齒生物","ㄨ","2","10020","咬食性哺乳動物的總稱。","ㄧㄝ","1","1002002"
"蛋","ㄢ","1","10021","由鳥類或爬蟲類等的雌性所產下，以殼包覆著的球狀物體。","ㄢ","1","1002100"
"卵","ㄨㄢ","2","10021","雌性生物的生殖細胞。","ㄨㄢ","1","1002101"
"鳥巢","ㄠ","2","10021","鳥類用樹枝築成的家，會在這裡産卵。","ㄧㄠ","1","1002102"
"燕窩","ㄨㄛ","2","10021","燕子所築的巢，中醫認為其有高度營養價值。","ㄧㄢ","1","1002103"
"船","ㄨㄢ","1","10022","載著人或物在水上前進的交通工具。","ㄨㄢ","1","1002200"
"軍艦","ㄧㄢ","1","10022","海軍使用的軍用船隻。","ㄩㄣ","1","1002201"
"帆船","ㄨㄢ","2","10022","張帆後以風力前進的船。","ㄢ","1","1002202"
"航海","ㄞ","2","10022","以大型船隻航海。","ㄤ","1","1002203"
"大航海時代","ㄞ","2","10022","十五世紀歐洲人開始開發遠程海上航線的時代。","ㄚ","1","1002204"
"貿易","ㄧ","2","10022","互通有無的大規模商業行為。","ㄠ","1","1002205"
"牛奶","ㄞ","1","10023","牛所流出的乳汁。除了可以直接飲用，還能加工成起司或奶油，是很棒的東西。","ㄧㄡ","1","1002300"
"ㄋㄟㄋㄟ","ㄟ","2","10023","「牛奶」的別種說法。要說出口有點丟臉。","ㄟ","1","1002301"
"酸奶","ㄞ","2","10023","某些地區是這麼稱呼優酪乳的。","ㄨㄢ","1","1002302"
"伊麗莎白","ㄞ","3","10023","伊麗莎白牧場裡的牛的名字，是真陽的夥伴。","ㄧ","1","1002303"
"巧克力","ㄧ","1","10024","將可可豆加工後的點心。在2月14日會被人大量消耗。","ㄧㄠ","1","1002400"
"朱古力","ㄧ","2","10024","賭神愛吃的甜食。","ㄨ","1","1002401"
"甜食","ㄕ","2","10024","味道是甜的，疲倦時會想吃。","ㄧㄢ","1","1002402"
"哆啦喜歡的東西","ㄧ","3","10024","一旦試過就再也無法放手。","ㄨㄛ","1","1002403"
"橡果","ㄨㄛ","1","10025","堅硬樹木的果實。不適合人類食用，但會刺激小孩子的收集慾望，充滿魅力的樹木的果實。","ㄧㄤ","1","1002500"
"果實","ㄕ","2","10025","會長成樹木的果實。","ㄨㄛ","1","1002501"
"堅果","ㄨㄛ","2","10025","被硬殼包覆著食用的果實。可放入點心或是當成下酒菜，在各處受到重用。","ㄧㄢ","1","1002502"
"鈴的點心","ㄧㄣ","3","10025","雖然不及紅豆麵包，但鈴好像也喜歡的樣子。對戰時丟向敵人能讓其暈眩。","ㄧㄥ","1","1002503"
"草莓","ㄟ","1","10026","小小的又酸酸甜甜的水果。一顆顆的會被以為是種子，其實是果實。","ㄠ","1","1002600"
"野莓","ㄟ","2","10026","在野外自由生長的莓果。","ㄧㄝ","1","1002601"
"莓果","ㄨㄛ","2","10026","一種小的、果肉狀的且可經常食用的水果。","ㄟ","1","1002602"
"老虎","ㄨ","1","10027","大型貓科猛獸，肉食動物。","ㄠ","1","1002700"
"猛獸","ㄡ","2","10027","高攻擊性動物的俗稱，通常是肉食動物。","ㄥ","1","1002701"
"茉莉的憧憬","ㄧㄥ","3","10027","虎虎！","ㄛ","1","1002702"
"無敵英雄虎虎","ㄨ","3","10027","茉莉仰慕的正義英雄。不能吐嘈那名字。","ㄨ","1","1002703"
"兔子","ㄗ","1","10028","有著長長耳朵和短短尾巴的可愛哺乳類。作為寵物也很受歡迎。","ㄨ","1","1002800"
"玩偶","ㄡ","1","10028","將布縫合後裝入棉花，做成像人或動物的形狀的東西。","ㄨㄢ","1","1002801"
"娃娃","ㄨㄚ","2","10028","仿造人或生物製作的東西。有各種材質，可當玩具或作觀賞用、祭祀用等有各種用途。","ㄨㄚ","1","1002802"
"亞瑟","ㄜ","3","10028","真步的一隻玩偶。名稱的意象來自亞瑟王和圓桌騎士。","ㄧㄚ","1","1002803"
"炸彈","ㄢ","1","10029","爆發後會產生熱與衝擊，並破壞、殺傷對方的一種兵器。超危險。","ㄚ","1","1002900"
"危險物品","ㄧㄣ","2","10029","可能會危及生物或環境的物質。操作時可能需要有證照。","ㄨㄟ","1","1002901"
"遠距離武器","ㄧ","2","10029","指可以飛得很遠的攻擊型武器，會爆炸的東西還是丟的遠遠的比較好吧？","ㄩㄢ","1","1002902"
"禊的惡作劇道具","ㄩ","3","10029","還是好好地被罵一次比較好。","ㄧ","1","1002903"
"西瓜","ㄨㄚ","1","10030","瓜科的大型果實。綠色條紋的外皮，紅色果肉與黑色種子令人印象深刻。","ㄧ","1","1003000"
"夏天風情","ㄧㄥ","2","10030","用來表示夏天感覺的東西。除了西瓜，其他還有大海或煙火等。","ㄧㄚ","1","1003001"
"清涼退火","ㄨㄛ","2","10030","某些食物吃了會有消暑的感覺。","ㄧㄥ","1","1003002"
"馬","ㄚ","1","10031","馬科的大型哺乳類。由於力量強大，還能快速跑步，大家很常將其作為家畜或賽馬。","ㄚ","1","1003100"
"驢子","ㄗ","1","10031","馬科的哺乳類。和馬比起來雖然小，但力量強大，作為勞動力很受人重視。","ㄩ","1","1003101"
"純種馬","ㄚ","2","10031","用馬的種類將品種改良成競賽用的類型。","ㄨㄣ","1","1003102"
"夢魘","ㄧㄢ","3","10031","戰隊競賽時登場的馬型魔物。","ㄥ","1","1003103"
"椅子","ㄗ","1","10032","為了坐下用的家具。也有顯示職位、地位的意義。","ㄧ","1","1003200"
"家具","ㄩ","2","10032","放在室內，平時使用的道具總稱。","ㄧㄚ","1","1003201"
"小學椅","ㄧ","2","10032","小學生使用的課桌椅。","ㄧㄠ","1","1003202"
"公會小屋道具","ㄩ","3","10032","放在公會小屋的家具或裝飾品。從豪華的設計到獨特的物品，其變化非常豐富。","ㄨㄥ","1","1003203"
"海","ㄞ","1","10033","在陸地之外的凹陷處會不斷蓄滿水的地方。","ㄞ","1","1003300"
"淺灘","ㄢ","1","10033","陸地和大海相連的地方。","ㄧㄢ","1","1003301"
"潮汐","ㄧ","2","10033","受到月球引力影響，海水往陸地推移或遠離的現象。","ㄠ","1","1003302"
"浪花","ㄨㄚ","2","10033","海浪受岸邊地形影響被打散時所出現的四濺水花。","ㄤ","1","1003303"
"瑪爾傑海岸","ㄢ","3","10033","雖然是可以從蘭德索爾徒步到達的受歡迎海灘，但是常出現魔物，意外的很危險。","ㄚ","1","1003304"
"貝殼","ㄜ","1","10034","包覆在貝類外側的殼。掉在沙灘上會讓人不自覺想收集。","ㄟ","1","1003400"
"甲殼類","ㄟ","2","10034","有著堅硬外骨骼的節肢動物。蝦、蟹，還有水蚤都算在內。","ㄧㄚ","1","1003401"
"寄居蟹騎士","ㄕ","3","10034","蘭德索爾的所到之處出現的魔物。外觀像鎧甲一樣堅硬，是難對付的敵人。","ㄧ","1","1003402"
"笛","ㄧ","1","10035","一般是指木管樂器。分為直笛與橫笛。","ㄧ","1","1003500"
"直笛","ㄧ","1","10035","木管樂器之一。不能用來玩擊劍遊戲。","ㄓ","1","1003501"
"管樂器","ㄧ","2","10035","樂器分類中的一種。吹入氣息，震動管內的空氣來發出聲音。","ㄨㄢ","1","1003502"
"豎笛","ㄧ","2","10035","以直立方式吹奏的笛子。直笛或單簧管等。","ㄨ","1","1003503"
"書本","ㄣ","1","10036","在一疊紙上印刷文字或圖畫後裝訂成冊的東西。","ㄨ","1","1003600"
"筆記","ㄧ","1","10036","寫下文字或圖畫用的文具。","ㄧ","1","1003601"
"小說","ㄨㄛ","2","10036","創作的故事。有戀愛、歷史、推理等，種類繁多。","ㄧㄠ","1","1003602"
"凱留的魔導書","ㄨ","3","10036","是書嗎？還是魔杖？","ㄞ","1","1003603"
"魚","ㄩ","1","10037","魚類一般的稱呼方式。傳說吃了會變聰明。","ㄩ","1","1003700"
"小魚","ㄩ","1","10037","魚類一般的稱呼方式。據說年紀大後，比起肉會更想吃牠。","ㄧㄠ","1","1003701"
"鮪魚","ㄩ","2","10037","魚的一種。又大又美味的高級魚。說到壽司就是這個。","ㄨㄟ","1","1003702"
"海洋生物","ㄨ","2","10037","生活在海洋中的生命體。","ㄞ","1","1003703"
"樹","ㄨ","1","10038","是樹木。","ㄨ","1","1003800"
"杉木","ㄨ","2","10038","用來當聖誕樹的針葉樹。大株的還會長到40公尺。","ㄢ","1","1003801"
"聖誕節","ㄧㄝ","2","10038","雖然不清楚是何時開始及為什麼，但是聖誕老公公送禮的日子。","ㄥ","1","1003802"
"耶誕樹","ㄨ","2","10038","耶誕節時的標誌裝飾物，將燈飾、彩帶等飾品掛在樹上而成。","ㄧㄝ","1","1003803"
"平安夜","ㄧㄝ","2","10038","聖誕節前一天的夜晚，也指聖誕節天亮前的深夜。","ㄧㄥ","1","1003804"
"忘却的頌歌","ㄜ","3","10038","和千歌一起，在聖夜於咲戀育幼院發生的奇蹟故事。","ㄨㄤ","1","1003805"
"棒棒糖","ㄤ","1","10039","有棍子的糖果。","ㄤ","1","1003900"
"甜食","ㄕ","2","10039","甜甜的很好吃，含在口中的感覺最棒了！","ㄧㄢ","1","1003901"
"克蘿依的點心","ㄧㄣ","3","10039","光是拿著，那畫面就像一幅畫。","ㄜ","1","1003902"
"玩具槌","ㄨㄟ","1","10040","上面是柔軟的，用波浪管製成的玩具。被打到會發出滑稽的聲音。","ㄨㄢ","1","1004000"
"鐵鎚","ㄨㄟ","2","10040","上面是由金屬製成的鈍器。被打到會很痛。","ㄧㄝ","1","1004001"
"小槌","ㄨㄟ","2","10040","小槌子。搖晃它可能會出現各種東西，也可能不會出現。","ㄧㄠ","1","1004002"
"祈梨的武器","ㄧ","3","10040","祈梨的武器。動作很可愛，但進行的攻擊很兇狠。","ㄧ","1","1004003"
"星星","ㄧㄥ","1","10041","在夜空發光的天體。","ㄧㄥ","1","1004100"
"海星","ㄧㄥ","2","10041","星形的海洋生物。不適合食用。","ㄞ","1","1004101"
"亮晶晶","ㄧㄥ","2","10041","發光模樣的一種表現。","ㄧㄤ","1","1004102"
"流星","ㄧㄥ","2","10041","初音的必殺技","ㄧㄡ","1","1004103"
"蘭德索爾的形狀","ㄨㄤ","3","10041","不從空中看的話不會知道。","ㄢ","1","1004104"
"帽子","ㄗ","1","10042","戴在頭上的飾品。","ㄠ","1","1004200"
"紳士","ㄕ","1","10042","謹守禮儀的男士，也可以指社經地位高的人士。","ㄣ","1","1004201"
"禮帽","ㄠ","2","10042","「帽子」的種類之一。","ㄧ","1","1004202"
"杯子","ㄗ","1","10043","裝飲料等的容器。","ㄟ","1","1004300"
"可可","ㄜ","1","10043","以可可樹的果實製成的飲品。","ㄜ","1","1004301"
"馬克杯","ㄟ","2","10043","「杯子」的種類之一。","ㄚ","1","1004302"
"摩卡","ㄚ","2","10043","混合巧克力的咖啡。","ㄛ","1","1004303"
"狗","ㄡ","1","10044","會汪汪叫的動物。","ㄡ","1","1004400"
"犬","ㄩㄢ","1","10044","「狗」的別種說法。","ㄩㄢ","1","1004401"
"狼","ㄤ","2","10044","「狗」的同類。野生之力。","ㄤ","1","1004402"
"月月","ㄩㄝ","2","10044","哈士奇的暱稱。","ㄩㄝ","1","1004403"
"哈士奇","ㄧ","2","10044","非常像狼的大型犬種，可以當作寵物，如果你可以接受牠許多讓人哭笑不得的行為。","ㄚ","1","1004404"
"旗子","ㄗ","1","10045","輕飄飄的布。","ㄧ","1","1004500"
"戰旗","ㄧ","2","10045","軍隊在戰鬥時使用的旗子，用以分辨敵我，也可以當作下達指令的工具。","ㄢ","1","1004501"
"信號旗","ㄧ","2","10045","用來傳遞訊息的旗子，通常是透過暗號或旗語來運作。","ㄧㄣ","1","1004502"
"蛋糕","ㄠ","1","10046","很棒的點心。甜甜的很好吃。","ㄢ","1","1004600"
"點心","ㄧㄣ","2","10046","很棒的食物。","ㄧㄢ","1","1004601"
"生日快樂","ㄜ","2","10046","準備好要唱生日快樂歌了嗎？","ㄥ","1","1004602"
"羈絆點數","ㄨ","3","10046","羈絆的深遠不只是共同渡過的時間。卡路里也是羈絆的證明……","ㄧ","1","1004603"
"綜合莓果蛋糕","ㄠ","3","10046","大家的最愛，就不說是什麼了，直接加上30羈絆值。","ㄨㄥ","1","1004604"
"麥克風","ㄥ","1","10047","將聲音轉換成信號的裝置。","ㄞ","1","1004700"
"唱歌","ㄜ","2","10047","麥克風是唱歌的必需品！","ㄤ","1","1004701"
"演唱會","ㄨㄟ","2","10047","在舞台上現場演奏。","ㄧㄢ","1","1004702"
"偶像的必備物品","ㄧㄣ","2","10047","要是沒有這個就無法開始。","ㄡ","1","1004703"
"閃耀麥克風","ㄥ","3","10047","望的專用裝備。有慈樂之音的標誌！","ㄢ","1","1004704"
"口紅","ㄨㄥ","1","10048","能襯出嘴唇的化妝品。","ㄡ","1","1004800"
"唇膏","ㄠ","1","10048","抹在嘴唇上，用來保護嘴唇的保養品。","ㄨㄣ","1","1004801"
"化妝品","ㄧㄣ","2","10048","為了美觀而塗抹在臉上的物品。","ㄨㄚ","1","1004802"
"年糕","ㄠ","1","10049","將穀物蒸煮後的東西。也是吉祥物。","ㄧㄢ","1","1004900"
"麻糬","ㄨ","1","10049","「年糕」的別種說法。","ㄚ","1","1004901"
"鏡餅","ㄧㄥ","2","10049","新年時可以供奉神佛，一大一小相疊的糯米糕。","ㄧㄥ","1","1004902"
"碳水化合物","ㄨ","2","10049","年糕的主要營養素。小心不要吃太多。","ㄢ","1","1004903"
"糯米糕","ㄠ","2","10049","以糯米製成的點心。","ㄨㄛ","1","1004904"
"妖精","ㄧㄥ","1","10050","嬌小又長著翅膀的種族。","ㄧㄠ","1","1005000"
"涅比亞","ㄧㄚ","3","10050","住在公會小屋的惡作劇妖精。","ㄧㄝ","1","1005001"
"雨傘","ㄢ","1","10051","主要是避雨用的傘。","ㄩ","1","1005100"
"遮陽傘","ㄢ","2","10051","主要是遮陽用的傘。","ㄜ","1","1005101"
"陽傘","ㄢ","2","10051","主要是遮陽用的傘。","ㄧㄤ","1","1005102"
"貪吃佩可夏日","ㄖ","3","10051","盛夏時海灘公主的必需品！","ㄢ","1","1005103"
"骰子","ㄗ","1","10052","為了產生亂數用的道具。","ㄞ","1","1005200"
"賭博","ㄛ","2","10052","賭博。骰子上的數字讓人一喜一憂。","ㄨ","1","1005201"
"六面體","ㄧ","2","10052","一般的骰子形狀。","ㄧㄡ","1","1005202"
"大富翁","ㄨㄥ","2","10052","使用骰子的桌遊。","ㄚ","1","1005203"
"洗八啦","ㄚ","2","10052","一種以骰子進行的賭博遊戲，許多香腸攤老闆都對這個遊戲有自己的見解。","ㄧ","1","1005204"
"信","ㄧㄣ","1","10053","將無法言喻的心意化為文字。","ㄧㄣ","1","1005300"
"郵件","ㄧㄢ","2","10053","透過郵遞系統移動的書信或包裹。","ㄧㄡ","1","1005301"
"情書","ㄨ","2","10053","用來傳達愛意的信。","ㄧㄥ","1","1005302"
"書信","ㄧㄣ","2","10053","用來傳遞訊息的文件。","ㄨ","1","1005303"
"飛鴿傳書","ㄨ","2","10053","古代利用鴿子傳遞訊息的方法。","ㄟ","1","1005304"
"葡萄","ㄠ","1","10054","是一串的。旁邊的好像很酸。","ㄨ","1","1005400"
"紫葡萄","ㄠ","1","10054","紫色的葡萄，說到葡萄，還是紫色的最常見。","ㄗ","1","1005401"
"巨峰","ㄥ","2","10054","「葡萄」的種類之一。","ㄩ","1","1005402"
"綿羊","ㄧㄤ","1","10055","有著鬆軟的毛。","ㄧㄢ","1","1005500"
"羊咩咩","ㄧㄝ","1","10055","對小孩子說羊的時候，有時候會這麼說。","ㄧㄤ","1","1005501"
"白羊","ㄧㄤ","2","10055","白色的羊。","ㄞ","1","1005502"
"瑪莉有隻小綿羊","ㄧㄤ","2","10055","真可愛呀～♪","ㄚ","1","1005503"
"豆腐","ㄨ","1","10056","用豆子製成的東國料理。","ㄡ","1","1005600"
"木綿豆腐","ㄨ","2","10056","「豆腐」的種類之一。野性的口感。","ㄨ","1","1005601"
"涼拌豆腐","ㄨ","2","10056","代表性的豆腐料理。","ㄧㄤ","1","1005602"
"杏仁豆腐","ㄨ","2","10056","杏仁做成的形狀像豆腐的甜品。","ㄧㄥ","1","1005603"
"鴨子","ㄗ","1","10057","不會飛的鳥。會嗄嗄的叫。","ㄧㄚ","1","1005700"
"鳥類","ㄟ","2","10057","也有會飛的鳥。也有不會飛的鳥。","ㄧㄠ","1","1005701"
"水鳥","ㄧㄠ","2","10057","依水而生的鳥類。","ㄨㄟ","1","1005702"
"蜻蜓","ㄧㄥ","1","10058","在空中飛的昆蟲。","ㄧㄥ","1","1005800"
"晏蜓","ㄧㄥ","2","10058","「蜻蜓」的種類之一。","ㄧㄢ","1","1005801"
"昆蟲","ㄨㄥ","2","10058","六支腳的動物。","ㄨㄣ","1","1005802"
"飛龍","ㄨㄥ","2","10058","「蜻蜓」的英文稱呼，直譯後的意思，很厲害吧。","ㄟ","1","1005803"
"葉子","ㄗ","1","10059","高等植物的營養器官。","ㄧㄝ","1","1005900"
"樹葉","ㄧㄝ","1","10059","樹木的葉子。","ㄨ","1","1005901"
"綠葉","ㄧㄝ","2","10059","綠色的葉子。","ㄩ","1","1005902"
"碧的朋友","ㄧㄡ","3","10059","碧可以毫無顧慮聊天的少數的朋友。是朋友。","ㄧ","1","1005903"
"戒指","ㄓ","1","10060","戴在手指上的飾品。","ㄧㄝ","1","1006000"
"鑽戒","ㄧㄝ","1","10060","鑲有鑽石的戒指。","ㄨㄢ","1","1006001"
"指環","ㄨㄢ","2","10060","圓圓的環。","ㄓ","1","1006002"
