41ee668c92991c5db692a916d384d84a86eb5cf1de991449959911dd43c03953,6721a4d747ba585d6a428e01e8b3c7158502a2608e3c31c2ab6a36f80976f9e7,aaee9627bb0efafc68bc46ec4cfd5ce880714079b1caabde0265b4b52f75fd7f,2455ba0376a1db46d82db40cf9e013ed7c1a810c12ea972656bb7d7b9effa60c,aa23ed5cfae42bc94b5b79267019c81acac469ed3b1f78fe9f4bd2d96e855e6d
"1","可透過活動，體驗特別的劇情。\n讀過可閱覽的劇情後，就會接著解放後續的劇情喔。\n聽說還有只要閱覽劇情就能達成的任務喔。","1","1011","1"
"2","挑戰看看活動冒險與Boss戰吧。\n閱覽特定的活動劇情，或是於活動冒險‧Boss戰畫面\n選擇「解放」就可以挑戰了喔。","1","1021","2"
"4","可透過獎勵交換換取「活動獎勵券」與各種道具。\n似乎只要抽到作為大獎的重置目標獎勵，\n就能進入下一個能獲得更多道具的獎勵清單喔。","1","1041","4"
"5","Boss戰分為３種不同難度。\n各個難度的Boss強度與戰鬥特徵各有不同，\n請確實做好萬全的準備，集中精神挑戰吧。","1","1051","5"
"6","Boss戰分為３種不同難度。\n各個難度的Boss強度與戰鬥特徵各有不同，\n請確實做好萬全的準備，集中精神挑戰吧。","1","1061","6"