9f76c2b525efa4017bd716bff73e6e36e8eced445d6e54606727bd374250ad6f,289b4872c24a257a0c4e15c323309e13781cfb918f633c4f726579dc2285aee2,c5e46d2e527828c8e72f8732d4824610fecf1d26ff6df5d4e3b952b136042122,4b0007232ededa7396a7902eeef8b9698cb2ce6e54906481c28fa72e0c4827cb,00d55e52473b0f3e55425ff62618ee73d8ac484e19332cac7b69a62a7f3e31f2,6f72eddf1ffc3d7129414deb9759e7dcab49588d5e28f87bd57244efada8ee07,583d37c1c8f2eb3ebf112fded569849dbefc0b476773a38f931efd8caca788c7,251b138b72f88048e7c82c64203d10c5e681127a6a278cfa85369f9a7797bc7c,f270c95d89a5f26b197fa729d60cce21a2906b76e31c80554a46d62b6c3ddfcf
"獲得珍稀款蒐藏中所有種類的周邊了！","0","0","0","0","2","101","16","獲得「珍稀款蒐藏」所有種類的周邊"
"獲得基本款蒐藏中所有種類的周邊了！","0","0","0","0","1","102","23","獲得「基本款蒐藏」所有種類的周邊"
"獲得祭典款蒐藏中所有種類的周邊了！","0","0","0","0","3","103","21","獲得「祭典款蒐藏」所有種類的周邊"
"由於蒐集到了所有周邊的50%，\n獲得了稱號\n「[FFBB00,CE4F00]慈樂之音箱推[-]」。","0","11001146","0","0","0","201","30","獲得所有周邊的50%"
"由於蒐集到了所有種類的周邊，\n獲得了稱號\n「[FFBB00,CE4F00]慈樂之音神推[-]」。","10101","11001147","10103","10102","0","202","60","獲得所有種類的周邊"