cd512d70d0c4abb0fe4a9d823879021d07b118aec3c001557453816f776d55f8,be50ac92db98eb6f233b730e2c33877965fcbc018bc1604e15dab7ff75332b05,ae80807629fe865e9181c5bb8a0a99461556d8628d964b67af23e2310b25817a,10a0637389c1b3425a8a262549095063e046b704490041d0876b2476872e42fc,cd63643d47868136797acd02af76d58212549b9de34b9c62cc96189170511305,b6706150fbc3633f118f8c8fb6e02c123ff77aee60f5c5b91c1e4326b9d52f41,e23349ed06627827588831a1640b59db82a994abcd3e85720331d7fe1f104874,e9954ba6a26e849e10597d27edff661cbd683166e329081a30077af6f7e27efe,1bd2b9a2fa69ac14ee77cb6037bc6a922f1953a04ceb342081958ee7d1c54e92,70eef841f4db4881c09e18aa4c3fb632a074d99a0cee8af91664ac349d8f1f03,3bddf96302fa5ef8d3b334044595fe865a0df4b01dd0f7f5743c86e3e6050b78,36c4216a2bf3e366578ae5d1379b7ad5d008a8264163036629b0f6255b4c24d2,5a019ba991d3b003aa8a684f664c4367ee2698cd43578fb874fd56205623f6f5,46295ba84b466a0d72c893cd2f1d98f0f8230b66ffd258ddf7f0eb5965c95cb0
"1","2","1","2025/06/01 16:00:00","3.414","1000001","2030/01/01 14:59:59","0","1","花凜","62","190801","如果完成任務的話，\n就能夠獲得獎勵哦！\n請加油吧","-416.5"
"1","2","1","2025/06/01 16:00:00","3.099","1000002","2030/01/01 14:59:59","0","2","花凜","62","190801","將任務完成，\n並獲得獎勵吧！","-416.5"
"1","2","1","2025/06/01 16:00:00","2.801","1000003","2030/01/01 14:59:59","0","3","花凜","63","190801","似乎有能夠\n領取的獎勵了，\n請確認看看","-416.5"
"1","2","2","2025/06/01 16:00:00","0","1000004","2030/01/01 14:59:59","0","4","花凜","63","190801","能夠領取獎勵了！\n請檢查看看","-416.5"
"1","1","2","2025/06/01 16:00:00","2.12","1000005","2030/01/01 14:59:59","0","5","花凜","64","190801","這裡是公會管理協會！\n如果您持有活動獎勵券，就能夠交換各種道具哦","-363"
"1","2","1","2025/06/01 16:00:00","1.68","1000006","2030/01/01 14:59:59","0","6","花凜","64","190801","辛苦了！\n在這裡，能夠以活動獎勵券來換取道具哦","-363"
"1","1","2","2025/06/01 16:00:00","2.33","1000007","2030/01/01 14:59:59","0","7","花凜","64","190801","一直以來都很謝謝你！\n要交換獎勵嗎？\n那就以活動獎勵券來進行交換吧","-363"
"10201","7","3","2025/06/01 16:00:00","5.18","1020101","2030/01/01 14:59:59","-6","101","拉比林斯達","61","133701","這次的敵人對我來說\n也是無法置之不理的存在\n少年，我也會全力以赴\n一起保護這個世界吧","-285"
"10201","2","1","2025/06/01 16:00:00","8.77","1020102","2030/01/01 14:59:59","-2","201","克莉絲提娜","61","133901","感覺到能消除無聊的\n戰鬥的氣息了啊，小子\n趕快帶我過去吧\n我會順手幫忙保護這個世界","-285"
"10201","1","6","2025/06/01 16:00:00","15.5","1020103","2030/01/01 14:59:59","0","301","似似花","61","133801","哦，需要我的力量……是嗎？\n格列戈爾會去幫忙的喔\n看你一臉想問我是不是不上場\n……我會考慮的","-285"
"10202","5","2","2025/07/01 16:00:00","9.061","1020201","2030/01/01 14:59:59","0","101","蘭法","61","134301","只屬於我的演唱……\n你願意一起尋找嗎……？\n有你在身邊……\n我就能更加努力……","-285"
"10202","2","1","2025/07/01 16:00:00","7.699","1020202","2030/01/01 14:59:59","0","201","千歌","61","134401","作為唱喚士，作為夥伴\n我都會盡我的全力\n……這些，都是\n多虧了你在背後推了我一把哦","-285"
"10203","2","1","2025/08/01 16:00:00","8.595","1020301","2030/01/01 14:59:59","0","101","碧","61","134601","世界和平由我跟克蘿茜肩負了對吧？\n雖然對我這種邊緣人來說有點沉重，\n但、但如果是兩個人的話，\n我會扛下來給你看的！","-285"
"10203","2","1","2025/08/01 16:00:00","7.758","1020302","2030/01/01 14:59:59","0","201","克蘿茜","61","134501","靠著這對新獲得的翅膀……\n無論騎士先生在哪裡，\n我都會馬上飛馳而去！\n克蘿茜‧航空軀體，出動！","-285"
"10204","6","2","2025/09/01 16:00:00","7","1020401","2030/01/01 14:59:59","0","101","露易絲瑪莉","61","132302","今天是和達令的第一次約會♪\n我們要一起逛街購物、然後……\n咦、我現在是通緝犯！？\n達、達令快救救我～！！","-285"
"10204","2","1","2025/09/01 16:00:00","7.904","1020402","2030/01/01 14:59:59","0","201","彩羽","61","132402","露易的奶奶人好溫柔、\n總是笑咪咪的，彩羽好喜歡她♪\n不過彩羽最喜歡的地方，\n還是那對超大超帥氣的角～♪","-285"
"10204","2","4","2025/09/01 16:00:00","8.487","1020403","2030/01/01 14:59:59","0","301","苑","61","132502","多虧望好不容易讓營收穩定下來，\n結果卻要暫停營業，損失好大。\n……不過，為了露易，\n就讓我來拚一把吧。彩羽我們走～","-285"
"10205","2","1","2025/10/01 16:00:00","8.763","1020502","2030/01/01 14:59:59","0","101","華音","61","134901","哦～呵呵♪\n能與本小姐呼吸一樣的空氣，\n你該感到十分幸運才是～♪\n哦～呵呵呵～♪","-285"
"10205","3","1","2025/10/01 16:00:00","6.417","1020503","2030/01/01 14:59:59","0","201","紡希","61","134801","要上囉，騎士先生！\n與華音一起同心協力……一起……\n……那個人到底是怎麼回事？\n我現在感到前所未有地不安耶！","-285"
"10206","7","3","2025/11/01 16:00:00","10.335","1020601","2030/01/01 14:59:59","0","101","厄莉絲","61","135001","「實現願望的海岸」嗎………\n分明可疑，阿賀斗紫布菜她們\n卻在悠閒嬉戲……真是看不下去。\n騎士先生就由我來保護。","-285"
"10206","4","2","2025/11/01 16:00:00","6.281","1020602","2030/01/01 14:59:59","0","201","雪菲","61","135101","難得的暑假，\n偶爾也在海灘上悠哉一下吧。\n……咦，難道說這個夏天，\n也沒辦法好好休息嗎？","-285"
"10206","2","1","2025/11/01 16:00:00","12.244","1020603","2030/01/01 14:59:59","0","301","普蕾西亞","61","135201","吃很多。吃飽飽。\n長、大大。\n應該，就能守護、正義。\n哥，一起。來吃、西瓜吧。","-285"
"10207","8","2","2025/12/01 16:00:00","6.339","1020701","2030/01/01 14:59:59","0","101","可璃亞","61","135301","一個夏日的冒險開始！\n安涅默涅小姐也能好好享受就好了。\n……可以的話，\n希望我們能再變得更要好一點……","-285"
"10207","9","7","2025/12/01 16:00:00","8.184","1020702","2030/01/01 14:59:59","0","201","安涅默涅","61","135401","──夢幻之花……\n是否真的存在還是個謎──不過。\n要我陪同一起去找，\n也不是不可以。","-285"
"10208","2","9","2026/01/01 16:00:00","3.906","1020801","2030/01/01 14:59:59","0","101","埃拉","61","129101","啊哈哈！笑口常開福氣自來！\n我相信只要保持笑容，\n即使是複製品世界也會迎來未來！\n妳說對吧，志那都！","-285"
"10208","2","1","2026/01/01 16:00:00","14.465","1020802","2030/01/01 14:59:59","0","201","志那都","61","129201","跨越反覆重置後的未來。\n無論許願幾次都無法求得的未來。\n……但我不會放棄的，絕對不會。\n妳也是對吧……埃拉？","-285"
"10208","3","4","2026/01/01 16:00:00","8.662","1020803","2030/01/01 14:59:59","0","301","日和","61","100101","埃拉的世界裡，\n大家也都拚命地活著……！\n……但是卻遇到了世界的危機！\n我一定、一定會幫上忙的！","-285"
"10208","3","1","2026/01/01 16:00:00","10.915","1020804","2030/01/01 14:59:59","0","401","怜","61","100301","志那都……另一個我。\n她珍視的這個世界，\n我絕對不會讓它迎來終結……！\n為了和她一同歡笑的未來！","-285"
"10209","7","1","2026/02/01 16:00:00","6.042","1020901","2030/01/01 14:59:59","0","101","雪野","61","135802","啊，你、你好……\n別、別一直盯著儂看。\n那個，儂會很害羞……\n身體會變熱，好像要融化了……","-285"
"10209","1","4","2026/02/01 16:00:00","9.402","1020902","2030/01/01 14:59:59","0","201","剎鬼","61","135903","為什麼我會變成幽靈……莫名其妙。\n這樣可是會死不瞑目呢。\n抱歉啦，但這也是某種緣分，\n請多指教啊，騎士公。","-285"
"10209","1","8","2026/02/01 16:00:00","8.16","1020903","2030/01/01 14:59:59","0","301","璐璐伊","61","136902","嗚、嗚啾嚕……\n為了救活剎鬼姐接，\n首先，要先填飽肚子……！\n章魚燒，請享用吧。","-285"
"10210","2","3","2026/03/01 16:00:00","5","1021001","2030/01/01 14:59:59","0","101","霞","61","137401","許久沒造訪吉歐‧格黑納，\n在歡迎派對上竟發生了殺人事件！\n賭上蘭德索爾名偵探之名，\n就讓我來解開真相吧！","-285"
"10210","1","4","2026/03/01 16:00:00","8.12","1021002","2030/01/01 14:59:59","0","201","阿剌克涅","61","136001","……我到底是什麼人呢？\n又到底來自何方呢？\n要是能查明這起事件的真相，\n感覺就能知道些什麼。","-285"
"10210","2","4","2026/03/01 16:00:00","6.386","1021003","2030/01/01 14:59:59","0","301","拿娜","61","136202","什麼是「推理」和「駁回」，\n聽起來太難了，拿娜不懂……\n但是為了朋友與甜甜圈，\n拿娜會努力加油喔！","-285"
"10211","4","3","2026/04/01 16:00:00","7.438","1021101","2030/01/01 14:59:59","0","101","優衣","61","136402","我想把心意傳達給騎士先生……\n所以。美空，我會加油的！\n……奇怪？為什麼我\n會這麼拼命呢……？","-285"
"10211","5","1","2026/04/01 16:00:00","8.35","1021102","2030/01/01 14:59:59","0","201","美空","61","136302","與騎士同學的約會就交給我吧★\n所以優衣妳可以\n放心地專注在計畫上……\n要盡情地臉紅心跳哦。","-285"
"10212","2","1","2026/05/01 16:00:00","5","1021201","2030/01/01 14:59:59","0","101","靜流","61","136501","新年要到了呢！\n新年料理和裝飾\n全都可以交給姐姐哦♪\n大家一起迎接快樂新年吧！","-285"
"10212","2","1","2026/05/01 16:00:00","5.25","1021202","2030/01/01 14:59:59","0","201","璃乃","61","137902","不管是家裡大掃除或麻煩，\n就算是動搖世界的危機也一樣！\n今年的事就要在今年之內\n快快解決乾淨！","-285"
"10212","2","1","2026/05/01 16:00:00","7.5","1021203","2030/01/01 14:59:59","0","301","拉比林斯達","61","106801","年末是公會長也\n不得不四處奔波忙碌的時期！\n這一年雖然發生了很多事，\n你我還是要過個好年喔，少年！","-285"
"10213","2","1","2026/06/01 16:00:00","8.204","1021301","2030/01/01 14:59:59","0","101","萊拉耶爾","61","126501","異國料理的陣陣香氣……\n光是聞到，就令人感覺像在\n環遊世界呢。呵呵，好了，\n克蘿茜，別興奮過頭了……♪","-285"
"10213","2","1","2026/06/01 16:00:00","7.176","1021302","2030/01/01 14:59:59","0","201","涅妃‧涅羅","61","129701","同異世界的公主以烹飪對決……\n為促成令人深感興致、\n饒富趣味的華麗祭典圓滿舉行，\n奴家願盡棉薄之力。","-285"
"10213","5","1","2026/06/01 16:00:00","8.602","1021303","2030/01/01 14:59:59","0","301","薇歐莉特","61","133101","為了「公主小餐館」，\n我反覆進行了料理特訓。\n我要用這道料理，填滿騎士大人……\n不，不對，是填滿大家的心與肚子！","-285"
"10213","3","1","2026/06/07 16:00:00","10.14","1021304","2030/01/01 14:59:59","0","102","萊拉耶爾","61","138101","由多樣滋味交織而成的和諧感，\n那正是我國的驕傲。\n若是有人企圖擾亂，\n我可不會溫柔以待喔？","-285"
"10213","7","1","2026/06/07 16:00:00","10.152","1021305","2030/01/01 14:59:59","0","202","涅妃‧涅羅","61","138201","煉獄穢土中，百姓的心意格外耀眼。\n守護這份心意便是奴家的職責。\n無論前方有著何種困難，\n這堅定不移的驕傲絕不動搖。","-285"
"10213","3","4","2026/06/07 16:00:00","9.688","1021306","2030/01/01 14:59:59","0","302","薇歐莉特","61","138001","背面世界的諸位已經脫離危機，\n只剩下蘭德索爾的各位了……\n為了救出他們，拜託了……\n站起來吧，貪吃佩可公主……！","-285"
"10213","1","2","2026/06/13 16:00:00","5.928","1021307","2030/01/01 14:59:59","0","401","貪吃佩可","61","138301","各位，讓你們久等了。\n貪吃佩可，完全復活☆\n為了守護大家的餐桌，\n我再也不會氣餒了！","-285"