fa1bd7a0531bcdae6442db6a41074d35071bd88ae03cbed75f40b726f91baeaf,e617830d21edce36e8b01ecca43cb623f22ae854c876704dc116cb5106fe8a20,27a42cd8b95ffb2314ead0de98a09c25c414882de908af2ff1e6d89c3b13949a,8ffb2aeb2e295b57a8b5857cef16e816ced418338859b4720d65f2a31b2851dd,baf32150a566f36a1940c8c5c487bc39c88cb3d2ca84d052332d3fd2eb0cf3e7,edcab9f284990fe518ef3508a663e79baf17d4d6b2026bbf79807ae79596866d,5a5f7fe0ab384434fc6d412604af1408702cff04fcadf452cfcd3b82dd96f197,23ee24a97dfed7b692fd76da330833a8a78e444d0ad718709db8aea6aafe84bf
"200","1","1","100","平凡な\n未鑑定トレジャー","正体不明な謎のお宝。ギルド管理協会出張所まで持ち込むとカリンに鑑定してもらえる。鑑定の結果、レアリティが上がる場合がある。","53001","平凡な未鑑定トレジャー"
"400","2","1","200","貴重な\n未鑑定トレジャー","正体不明な謎のお宝。ギルド管理協会出張所まで持ち込むとカリンに鑑定してもらえる。鑑定の結果、レアリティが上がる場合がある。","53002","貴重な未鑑定トレジャー"
"800","3","1","400","至高の\n未鑑定トレジャー","正体不明な謎のお宝。ギルド管理協会出張所まで持ち込むとカリンに鑑定してもらえる。","53003","至高の未鑑定トレジャー"
"200","1","0","100","平凡なジェムストーン","平凡なトレジャー。ギルド管理協会出張所まで持ち込むと、少額のキャラバンコインに換金できる。","53004","平凡なジェムストーン"
"400","2","0","200","貴重なジェムストーン","珍しいトレジャー。ギルド管理協会出張所まで持ち込むと、キャラバンコインに換金できる。","53005","貴重なジェムストーン"
"800","3","0","400","至高のジェムストーン","非常に珍しいトレジャー。ギルド管理協会出張所まで持ち込むと、多額のキャラバンコインに換金できる。","53006","至高のジェムストーン"
"200","1","0","100","平凡なインゴット","平凡なトレジャー。ギルド管理協会出張所まで持ち込むと、少額のキャラバンコインに換金できる。","53007","平凡なインゴット"
"400","2","0","200","貴重なインゴット","珍しいトレジャー。ギルド管理協会出張所まで持ち込むと、キャラバンコインに換金できる。","53008","貴重なインゴット"
"800","3","0","400","至高のインゴット","非常に珍しいトレジャー。ギルド管理協会出張所まで持ち込むと、多額のキャラバンコインに換金できる。","53009","至高のインゴット"
"200","1","0","100","平凡なスクロール","平凡なトレジャー。ギルド管理協会出張所まで持ち込むと、少額のキャラバンコインに換金できる。","53010","平凡なスクロール"
"400","2","0","200","貴重なスクロール","珍しいトレジャー。ギルド管理協会出張所まで持ち込むと、キャラバンコインに換金できる。","53011","貴重なスクロール"
"800","3","0","400","至高のスクロール","非常に珍しいトレジャー。ギルド管理協会出張所まで持ち込むと、多額のキャラバンコインに換金できる。","53012","至高のスクロール"
"200","1","0","100","平凡なティアラ","平凡なトレジャー。ギルド管理協会出張所まで持ち込むと、少額のキャラバンコインに換金できる。","53013","平凡なティアラ"
"400","2","0","200","貴重なティアラ","珍しいトレジャー。ギルド管理協会出張所まで持ち込むと、キャラバンコインに換金できる。","53014","貴重なティアラ"
"800","3","0","400","至高のティアラ","非常に珍しいトレジャー。ギルド管理協会出張所まで持ち込むと、多額のキャラバンコインに換金できる。","53015","至高のティアラ"
"200","1","0","100","平凡なルーン","平凡なトレジャー。ギルド管理協会出張所まで持ち込むと、少額のキャラバンコインに換金できる。","53016","平凡なルーン"
"400","2","0","200","貴重なルーン","珍しいトレジャー。ギルド管理協会出張所まで持ち込むと、キャラバンコインに換金できる。","53017","貴重なルーン"
"800","3","0","400","至高のルーン","非常に珍しいトレジャー。ギルド管理協会出張所まで持ち込むと、多額のキャラバンコインに換金できる。","53018","至高のルーン"
"200","1","0","100","平凡なクラウン","平凡なトレジャー。ギルド管理協会出張所まで持ち込むと、少額のキャラバンコインに換金できる。","53019","平凡なクラウン"
"400","2","0","200","貴重なクラウン","珍しいトレジャー。ギルド管理協会出張所まで持ち込むと、キャラバンコインに換金できる。","53020","貴重なクラウン"
"800","3","0","400","至高のクラウン","非常に珍しいトレジャー。ギルド管理協会出張所まで持ち込むと、多額のキャラバンコインに換金できる。","53021","至高のクラウン"
"200","1","0","100","平凡なアーティファクト","平凡なトレジャー。ギルド管理協会出張所まで持ち込むと、少額のキャラバンコインに換金できる。","53022","平凡なアーティファクト"
"400","2","0","200","貴重なアーティファクト","珍しいトレジャー。ギルド管理協会出張所まで持ち込むと、キャラバンコインに換金できる。","53023","貴重なアーティファクト"
"800","3","0","400","至高のアーティファクト","非常に珍しいトレジャー。ギルド管理協会出張所まで持ち込むと、多額のキャラバンコインに換金できる。","53024","至高のアーティファクト"